title,sentiment_score,total score
44 Charles Street,0.5359666666666666,3
A Bite to Remember (Argeneau #5),0.8898,2
A Facebook Affair,0.8268,1
A Fortunate Blizzard,0.9967,1
"A Girl Called Fearless (A Girl Called Fearless, #1)",0.542025,4
"A Greyhound, a Groundhog",0.82405,4
A Little Bit Country,0.9964,1
A Little Princess,0.7579,1
A Love Letter to Whiskey,0.5635,3
"A Raven's Heart (Secrets & Spies, #2)",0.9947,1
A Reason To Stay (Heroes #1),0.65855,4
"A Touch of Crimson (Renegade Angels, #1)",0.9805999999999999,4
"Accidentally Yours (A Match Made in Honeybrook, #1)",0.6453,1
"Alex + Ada, Vol. 1",0.5010102564102563,39
Alice's Adventures in Wonderland & Through the Looking-Glass,0.42305000000000004,2
"Altered (Altered, #1)",0.9605,1
"American Gods (American Gods, #1)",0.9348,1
"An Expert in Murder (Josephine Tey, #1)",-0.19489999999999996,2
Andromeda's Fall (Shadowcat Nation #1),0.9769,1
"Asunder (Dragon Age, #3)",0.9609,2
Balloons Over Broadway: The True Story of the Puppeteer of Macy's Parade,0.8549153846153847,13
Batman Vs. Two-Face,0.8489,1
Batman: The Killing Joke,0.4736327868852458,61
Beach Feet,0.84785,2
"Beautiful Ink (Forever Inked, #1)",0.6988000000000001,5
"Begin Again (Starting Over, #3)",0.9725,1
Big Truths for Little Kids,0.9482,1
Black Friday,-0.15464999999999998,2
"Blood Orchids (Lei Crime, #1)",0.28315999999999997,5
Bodyguard To A Sex God (Bodyguards Inc. #1),0.9969,1
Born a Crime: Stories From a South African Childhood,0.6975897959183672,49
"By Any Other Name (Forbidden, #1)",-0.2058,1
Camille and the Sunflowers: A Story about Vincent van Gogh,0.9298,1
Canterbury Tales,0.9973,1
"Catch Me (Steele Brothers, #1)",0.6562333333333333,3
"Caught in Crystal: A Lyra Novel (Lyra, #4)",0.9267,1
"Chasing Nikki (Chasing Nikki, #1)",0.8787333333333334,3
"Choices of Fate (Fate, #1)",0.9452500000000001,4
Citizen: An American Lyric,0.3049205128205129,117
"Clown'd (XXX'd, #1)",0.9936,1
"Come the Night (The Dangerous Delameres, #1)",0.9898,1
"Connected (Connections, #1)",0.9987,1
Crosswinds (Rising Storm #3),-0.26315,2
"Dark Salvation (Immortalis, #5)",0.998,1
Darkest Before Dawn - The Masked Man Serenade,0.6369,1
"Darkness (New Species, #12)",0.24791428571428575,7
"Devastation (Beastly Tales, #3)",0.91,1
"Dirty Deeds (Dirty, #1)",0.7317,1
Don't Let the Pigeon Drive the Bus!,0.561712,25
Draw Play,0.998,1
"Druid (Tales of Silver Downs, #3)",0.9789,1
"Dungeons & Dragons, Volume 2: First Encounters",0.9177,1
Elemental Magic: All-New Tales of the Elemental Masters,0.8589,2
"Embassy Row (Mycroft Holmes, #2)",0.5106,1
"Embrace the Hunger (Ra's Chosen, #4)",0.8998,1
"End of the Innocence (Innocence, #3)",0.8527799999999999,5
Escape from Mr. Lemoncello's Library (Mr. Lemoncello's Library #1),0.8487000000000001,44
Espresso Macchiato,0.8591,1
"Eva's Eye (Inspector Konrad Sejer, #1)",-0.2732,1
"Eve (Eve, #1)",0.969,1
"Every Dead Thing (Charlie Parker, #1)",-0.02706,5
"Exposed to You (One Night Of Passion, #2)",0.9890000000000001,2
Eyes on You,0.5680888888888889,9
"Fairest (The Lunar Chronicles, #3.5)",-0.8253,1
"Faking It (Ringside Romance, #2)",0.0,1
Fall Into Temptation (Blue Moon #2),0.6559999999999999,1
Fantasy for Sale,0.9926,1
Fatal Intent,0.8767499999999999,2
"Fer-de-Lance (Nero Wolfe, #1)",0.6502,3
Fire Dreams,-0.3937,1
"First Rider's Call (Green Rider, #2)",0.8462,1
"For Better or Worse (The Wedding Belles, #2)",0.9993,1
"Forever (The Wolves of Mercy Falls, #3)",0.5621714285714285,7
Forever Amish,0.9451,2
"Forever with You (Wait for You, #5)",0.9182666666666667,3
"Foxglove Summer (Peter Grant, #5)",0.613,2
Fraternize,0.9992,1
French Toast,0.8211333333333334,3
Fun Home: A Family Tragicomic,0.53398,15
George and Martha,0.8505,2
"Giant Days, Vol. 4 (Giant Days, #4)",0.4480363636363636,11
Girl With a White Dog,0.8625,1
Good Queen Bess: The Story of Elizabeth I of England,0.8909999999999999,1
Grace for Drowning,0.999,1
"Green Rider (Green Rider, #1)",0.65108,5
"Gregor the Overlander (Underland Chronicles, #1)",0.3056,1
"Gus (Bright Side, #2)",0.7794285714285715,7
Hellhole,0.6998,1
Her,-0.5859,1
"High Contrast (Evolution Ink, #1)",0.9822,1
"Hollow City (Miss Peregrine's Home for Peculiar Children, # 2)",0.9953,1
Holy Smoke (The Supernatural Bounty Hunter Files Book 8 of 10),0.4404,1
Home for a Bunny,0.6275999999999999,2
How to Knock Out Nightmares,0.9587,1
Huntress,0.7989357142857143,14
"I Heart You, You Haunt Me",0.8947200000000001,5
I Wrote This For You,0.6077662650602408,83
Ice Men of North Dakota (Dakota Heat #5),0.3182,1
"Iniquity (The Premonition, #5)",0.7942,1
Inspire Me: A Hot Rod Novel,0.9618,1
Jabberwocky,0.9019,1
Just Gotta Say,0.4882,2
Just Helping My Dad,0.9755,1
"Kept from You (Tear Asunder, #4)",0.9987,1
"Laces and Lace (Assassins, #6)",0.241725,4
Lead Us Not,0.6369,1
Learning to Love (Carson Hill Ranch #1),0.6124,1
"Left Drowning (Left Drowning, #1)",0.6491642857142856,14
Legally Charming (Ever After #1),0.9995,1
"Leveled (Saints of Denver, #0.5)",0.9864,1
Logan (Wild Boys After Dark #1; After Dark #1; Love in Bloom #43),0.9927,1
Losing It All,0.9419500000000001,2
"Lost Rider (Coming Home, #1)",0.9437,1
"Love Another Day (Masters and Mercenaries, #14)",0.6801,1
"Love Thy Neighbour (Friend-Zoned, #2)",0.53795,4
Lucien (Fueled By Lust #4),0.9977,1
Luck on the Line (On the Verge #1),0.9998,1
"Lumberjanes, Vol. 6: Sink or Swim",0.29576,10
"Lured In (Fishing for Trouble, #2)",0.999,1
Magic Words: From the Ancient Oral Tradition of the Inuit,0.9602333333333334,3
"Make Me Forget (Make Me, #1)",0.9933,1
"Man of My Dreams (Dreams, #1)",0.9969,2
Martin Luther: A Man Who Changed The World,0.7184,1
Me And Mr Darcy,0.2108,1
Mercy,-0.2186,2
"Mermaid Moon (Sunset Cove, #2)",0.8922333333333333,3
"Merry Christmas, Baby (Lucky Harbor, #12.5)",0.90345,2
Midwinterblood,0.8372999999999999,4
"Million Baller Baby (Bad Boy Ballers, #1)",0.9969,1
"Monstress, Vol. 1: Awakening (Monstress, #1)",0.7107209302325582,43
Moonburner (Moonburner Cycle #1),0.9879,1
"Mortal Arts (Lady Darby Mystery, #2)",0.18114999999999998,2
"Mortal Engines (The Hungry City Chronicles, #1)",0.5563,2
Mr. President,0.8268,1
"Murder Unleashed (Dead-End Job Mystery, #5)",-0.2145,1
My Everything (The Beaumont Series #1.5),0.9951,1
My Forever is You Book 2 of 2: Resolution,0.7984,1
My Pet Book,0.81465,2
"Nadar (Alien Warlord's Conquest, #1)",0.4805,1
"Nailbiter, Vol. 5: Bound by Blood",0.454175,4
"Nevermore (Maximum Ride, #8)",0.7289444444444445,9
Nowhere Ranch,0.9987,1
"Old City Hall (Detective Greene, #1)",0.9503,1
"Once Upon a Road Trip (Once Upon a Road Trip, #1)",0.9963500000000001,2
"One Night with the Cowboy (Whiskey River, #2)",0.9909,1
"Out of Order (The Survivor's Club, #1)",-0.3977,1
Penpal,0.039257142857142865,7
"Phantom Evil (Krewe of Hunters, #1)",0.4041,4
Phantom Kiss (Chicagoland Vampires #12.5),0.3751,3
"Phantom Shadows (Immortal Guardians, #3)",0.7270666666666666,6
"Picking up the Pieces (Picking up the Pieces, #1)",0.9989,1
"Picture Perfect (Aliso Creek, #1)",0.5574,1
"Playing the Game (Neighborly Affection, #1)",0.996,1
"Poison Promise (Elemental Assassin, #11)",0.0,1
Pride and Prejudice,0.6723999999999999,2
Prom and Prejudice,0.7476857142857144,7
"Proof (Bloodline Trilogy, #1)",0.7178,1
Ragnar's Claw,-0.29600000000000004,1
"Romancing the Duke (Castles Ever After, #1)",0.0,1
"Rough Justice (Sinner's Tribe Motorcycle Club, #1)",-0.4588,1
Sacrificed in Shadow (Ascension #1),0.70415,2
Salvage Trouble (Black Ocean #1),0.9729,1
Scandal: His Majesty's Love-Child (Dark-Hearted Desert Men #4),0.5106,1
"Second Kiss (Second Kiss, #1)",0.9837,1
"Secrets of the Sands (Children of the Desert, #1)",0.9949,1
See You at Harry's,0.5969272727272728,11
"Send Lawyers, Guns, and Roses (Heart and Haven, #2)",-0.6233,2
Seniorella,0.7184,1
Shifter Woods: Howl,0.9617,1
"Shiver (The Wolves of Mercy Falls, #1)",0.7181934782608694,46
"Sign, SEAL, Deliver (SEAL It With A Kiss Book 2)",0.6369,1
"Simply Irresistible (Chinooks Hockey Team, #1)",0.9892,1
"Skin Deep (Skin Deep, #1)",0.9158999999999999,2
"So Close to You (So Close to You, #1)",-0.06706666666666668,3
Sophie's Squash,0.6904166666666667,6
Southcrop Forest,0.9965,1
"Spirit (Gothika, #4)",0.9993,1
"Stargazer (Shayne's Supernaturals, #5)",0.7906,1
"Still Life in Brunswick Stew (A Cherry Tucker Mystery, #2)",-0.9524,1
Storm Runners (Storm Runners #1),0.5932,3
Strega Nona,0.5093909090909091,11
"Surrender (Steel Brothers Saga, #6)",0.836,1
"Swipe (Swipe, #1)",0.6742,2
"Swords of Mars (Barsoom, #8)",0.4939,1
Taffeta and Hotspur,0.9778,1
"Take (Scars of the Wraiths, #4)",-0.6597,1
Take a Chance: Erotic Romance Boxed Set,0.9387,1
"Taken: A One to Take Primer (One to Hold, #7.5)",0.9952,1
"Taking Faith (Stolen Hearts, #1.5)",0.7227,1
"Taunting Destiny (The Fae Chronicles, #2)",0.4233,2
"The Big Sleep (Philip Marlowe, #1)",0.8834,1
The Blue Moon Narthex,0.47324999999999995,2
"The Boyfriend Mandate (The Boyfriend Chronicles, #2)",0.9841,1
The Brilliant Fall of Gianna Z.,0.6450333333333333,3
"The Burning Room (Harry Bosch, #19; Harry Bosch Universe, #26)",0.5638785714285716,14
"The CEO's Seduction (Hamilton Family, #1)",0.4215,1
The Cairo Affair,0.043050000000000005,4
The Candymakers and the Great Chocolate Chase,0.9904,1
The Center of Everything,0.6750666666666666,9
"The Champion of Garathorm (The Chronicles of Castle Brass, #2)",0.9877,1
"The Chessmen of Mars (Barsoom, #5)",0.8957,1
"The Christmas Cookie Shop (Christmas Town, #1)",0.9948,1
The Couple Next Door,0.42834000000000005,35
The Cow Who Climbed a Tree,0.9074,2
"The Crimson Crown (Seven Realms, #4)",0.9209,1
"The Curse of the Mistwraith (Wars of Light and Shadow, #1)",0.91045,2
The Curse of the Rose (The Rose Chronicles #1),0.9947,1
"The Darkest Minds (The Darkest Minds, #1)",0.46240983606557373,61
The Deep,0.335725,12
The Dreamsnatcher (Dreamsnatcher #1),0.9936,1
The Dumas Club,0.5849,1
The Encyclopedia of Early Earth,0.85119375,16
"The Final Rule (My Brother's Keeper, #3)",0.5204,1
The Fixer Upper,0.6652,1
"The Forest of Hands and Teeth (The Forest of Hands and Teeth, #1)",0.3349133333333334,30
"The Golden Spiders (Nero Wolfe, #22)",0.1779,1
The Harrowing,0.9915,2
The House of Memory (Pluto's Snitch #2),0.431,2
The Innocent Man: Murder and Injustice in a Small Town,-0.25648181818181814,11
"The Japanese Tsunami, 2011 (I Survived, #8)",-0.9314,1
The Kindling (Middle School Magic #1),0.992,1
The Last Juror,0.2821444444444445,9
"The Lawyer's Luck (Home to Milford College, #0.5)",0.3818,1
The Little Friend,0.12833333333333335,18
The Little Prince & Letter to a Hostage,0.4884,2
The Long Drop,0.10396666666666665,3
The Magic Circle,0.991,1
The Medicine Man: Book 2,0.7206,1
The Memory Garden,0.0,1
"The Misadventures of the Family Fletcher (Family Fletcher, #1)",0.7992444444444443,9
The Missing Ones,0.9916499999999999,2
The Mistress Mistake,0.5994,1
"The Name of the Wind (The Kingkiller Chronicle, #1)",0.6928757575757575,66
"The One That Got Away (includes: Effingtons, #8.5)",0.7501,1
The Ones We Trust,0.712,2
The Paris Wife,0.46557142857142875,49
The Perfect Girl,0.0,1
The Purple Morrow,0.98,1
The Redeemer,0.7181,1
"The Riven Kingdom (Godspeaker Trilogy, #2)",0.9480999999999999,2
"The Scar-Crow Men (Swords of Albion, #2)",0.9881,1
The Secret Chicken Society,0.9485,1
The Secret Garden,0.27399999999999997,3
The Sheik's Dangerous Lover,-0.8271,1
The Snow Queen,0.9837666666666666,3
The Song Is You,0.9246,1
"The Space Between (The Walshes, #2)",0.9399,1
The Story of Growl,-0.17075000000000004,2
The Sudden Visibility of Sound,0.4211,1
The Thing About the Truth,0.606225,4
The Third Twin,-0.1273666666666667,3
The True Blue Scouts of Sugar Man Swamp,0.8012333333333334,3
"The Untamed Earl (Playful Brides, #5)",0.9843,1
"The Unwritten Series (Unwritten, #1-2)",0.9972,1
The Very Hairy Bear.,0.0049,1
The Very Hungry Zombie: A Parody,0.7637,2
"The Vile Village (A Series of Unfortunate Events, #7)",0.7406,1
"The Warlord of Mars (Barsoom, #3)",0.7483666666666666,3
"The Werewolf's Kiss (Voodoo Moon, #1)",0.1531,1
"The Werewolf's Sin (Voodoo Moon, #3)",0.8858,1
The Year of the Book (Anna Wang #1),0.7626333333333334,6
"The shape of water (Inspector Montalbano, #1).",0.4417,1
There Will Be Lies,0.06189999999999999,3
There's Someone Inside Your House,-0.1174888888888889,9
This Lullaby,0.575695,20
This is What Goodbye Looks Like,0.0,1
Three Sides of a Heart: Stories about Love Triangles,0.7843,1
"Throne of Glass (Throne of Glass, #1)",0.8852714285714286,7
"Throne of Jade (Temeraire, #2)",0.4957,4
Too Busy for Love,0.9397666666666668,3
"Two Girls (Two Girls, #1)",0.6941,1
"Unbroken: A World War II Story of Survival, Resilience, and Redemption",0.36296274509803905,102
"Undercover Boyfriend (One Fine Day, #1)",0.9969,1
Unhooked,0.13498,10
"Unmasked: Volume One (Unmasked, #1)",0.631,1
"Unmasked: Volume Two (Unmasked, #2)",0.0,1
"Valentine Wedding Hound (Have a Hart, #5)",0.9862,1
Vampire Love Story Boxed Set (Five Novels),0.9954,1
"Vampires Rule (Rule, #1)",0.9402,1
WOOF,0.9902,1
"Warhost of Vastmark (Wars of Light & Shadow, #3; Arc 2 - The Ships of Merior, #2)",0.9568,1
What He Wants,0.9413,1
Where The Lost Aprils Are,0.9945,1
Wicked Love (Wicked White #3),0.9497,1
Wishtree,0.8161222222222223,9
Worth the Wait (Guthrie Brothers #2),0.995,2
You Hold Me Up,0.9229999999999999,1
You Will Know Me,0.5686812499999998,16
Z Is for Moose,0.5177111111111111,9
rock,0.7692874999999999,8
